{
  "$schema": "https://json-schema.org/draft/2020-12/schema",
  "$id": "urn:arena:route-coverage:2",
  "title": "Per-deck route coverage (Gate 3; v2 adds the v3.3 deck-level layer)",
  "description": "Layer 1 (v3.2): every produces-feature of the deck's included combos classified against the WIN-ROUTES rules. Layer 2 (v3.3, the `deck` section): which win routes are actually expressible for THIS deck — direct routes from LETHAL/WIN_TRIGGER features plus conversion routes gated on payoff support from the 99 — with WIN-ROUTES §3 guards. status=blocked means no route is expressible: batch results would understate the deck, and DossierCheck refuses it.",
  "type": "object",
  "required": ["schema", "deck_id", "deck_hash", "win_routes_version", "combos", "deck", "unroutable_features", "status"],
  "properties": {
    "schema": { "const": "arena.route-coverage/2" },
    "deck_id": { "type": "string" },
    "deck_hash": { "type": "string", "pattern": "^[0-9a-f]{8,64}$" },
    "win_routes_version": { "type": "string" },
    "combos": {
      "type": "array",
      "items": {
        "type": "object",
        "required": ["id", "features", "direct_win"],
        "properties": {
          "id": { "type": "string" },
          "features": {
            "type": "array",
            "items": {
              "type": "object",
              "required": ["name", "category"],
              "properties": {
                "name": { "type": "string" },
                "category": { "enum": ["WIN_TRIGGER", "LETHAL", "RESOURCE", "GUARD", "TABLE_HAZARD", "BOARD_CONTROL", "LOCK_DISRUPTION", "CARD_CLASS", "UNROUTABLE"] },
                "routes": { "type": "array", "items": { "type": "string" } }
              },
              "additionalProperties": false
            }
          },
          "direct_win": { "type": "boolean", "description": "true when any feature is LETHAL or WIN_TRIGGER; false = resources only, payoff conversion required (the LethalityPlanner's job)." }
        }
      }
    },
    "deck": {
      "type": "object",
      "required": ["payoffs", "routes", "guards", "win_paths"],
      "properties": {
        "payoffs": {
          "description": "WIN-ROUTES §2b payoff class -> card names found in the 99 (plus the commander_creature pseudo-class). Only non-empty classes appear.",
          "type": "object",
          "additionalProperties": { "type": "array", "items": { "type": "string" } }
        },
        "routes": {
          "type": "array",
          "items": {
            "type": "object",
            "required": ["route", "origin", "support", "from_combos"],
            "properties": {
              "route": { "type": "string" },
              "origin": { "enum": ["direct", "conversion"], "description": "direct = a LETHAL/WIN_TRIGGER feature names it (combo is the payoff); conversion = reached from a RESOURCE feature class via 99-payoff support." },
              "support": { "enum": ["intrinsic", "supported", "partial", "unsupported"], "description": "intrinsic = no 99 support needed; supported = every requirement group has a full-strength payoff; partial = weaker alternates only (route usable with hazards); unsupported = not expressible via this deck's 99." },
              "from_combos": { "type": "array", "items": { "type": "string" } },
              "enablers": { "type": "array", "items": { "type": "string" }, "description": "Payoff/enabler cards from the 99 this route relies on — TutorWeights input." },
              "missing": { "type": "array", "items": { "type": "string" }, "description": "Payoff classes that would upgrade support — deckbuilding advice." }
            },
            "additionalProperties": false
          }
        },
        "guards": {
          "type": "array",
          "items": {
            "type": "object",
            "required": ["id", "severity", "detail"],
            "properties": {
              "id": { "type": "string" },
              "severity": { "enum": ["info", "warning", "blocking"] },
              "detail": { "type": "string" }
            },
            "additionalProperties": false
          }
        },
        "win_paths": { "type": "integer", "minimum": 0, "description": "Routes with support better than unsupported. 0 with included combos present = blocked." }
      },
      "additionalProperties": false
    },
    "unroutable_features": { "type": "array", "items": { "type": "string" } },
    "status": { "enum": ["clean", "unroutable_flagged", "blocked"] }
  },
  "additionalProperties": false
}
