{
  "schema": "arena.route-coverage/2",
  "deck_id": "selvala-b3",
  "deck_hash": "aabbccdd11223344",
  "win_routes_version": "win-routes/5",
  "combos": [
    {
      "id": "527-2816",
      "features": [
        { "name": "Infinite colored mana", "category": "RESOURCE" },
        { "name": "Infinitely large creature until end of turn", "category": "RESOURCE", "routes": ["SPREAD_COMBAT", "COMMANDER_DMG_SEQUENCE"] }
      ],
      "direct_win": false
    }
  ],
  "deck": {
    "payoffs": {
      "haste_static": ["Concordant Crossroads"],
      "mass_pump": ["Craterhoof Behemoth"],
      "commander_creature": ["Selvala, Heart of the Wilds"]
    },
    "routes": [
      {
        "route": "SPREAD_COMBAT",
        "origin": "conversion",
        "support": "supported",
        "from_combos": ["527-2816"],
        "enablers": ["Concordant Crossroads"]
      },
      {
        "route": "ORACLE_WIN",
        "origin": "conversion",
        "support": "unsupported",
        "from_combos": ["527-2816"],
        "missing": ["oracle_win"]
      }
    ],
    "guards": [
      {
        "id": "oracle_guard",
        "severity": "info",
        "detail": "DECK_ACCESS present but no oracle-class effect in the 99"
      }
    ],
    "win_paths": 1
  },
  "unroutable_features": [],
  "status": "clean"
}
